Date,Site_ID,GPS_Lat,GPS_Lon,Artifact_ID,Description,Depth_cm,Weather,Recorded_By
2025-06-02,CAMP,51.4218,-4.1329,,Camp established on shelf above hollow,0,Overcast,T. Reyes
2025-06-03,Trench A,51.4211,-4.1334,KH-01,Bronze seal - rearing hare motif with partial letter T,12,Overcast,M. Ilyas
2025-06-04,Trench A,51.4211,-4.1335,KH-02,Red-glazed pottery shard under collapsed lintel,34,Rain,M. Ilyas
2025-06-05,Site B,51.4209,-4.1327,,GPR anomaly flagged - rectangular, approx 80cm depth,0,Cold/Clear,E. Wren
2025-06-06,Site B,51.4209,-4.1327,KH-03,Stone chest lid exposed - cracked corner, largely intact,78,Cold/Clear,E. Wren
2025-06-07,Site B,51.4209,-4.1327,KH-04,Thornecliff Manuscript - vellum, illuminated, oilcloth wrapping,82,Clear,E. Wren
2025-06-08,CAMP,51.4218,-4.1329,,Unidentified observers at tree line (P. Nandan) - see incident report,0,Windy,T. Reyes
2025-06-09,CAMP,51.4218,-4.1329,,Site struck; KH-04 transported under seal to Caldbridge,0,Clear,E. Wren
